<artisti xmlns:xsi="http://www.w3.org/2001/XMLSchema-instance" xsi:noNamespaceSchemaLocation="artisti.xsd">
    <Artista genere="" imagePath="" nome="ArtistaTest_1747152587">
        <info></info>
        <prodotti>
            <TShirt colore="Nero" taglia="L">
                <Merch codiceProdotto="TPX">
                    <NotMusica disponibile="1" prezzo="10.00" quantita="50">
                        <ArtistProduct description="desc" imagePath="" title="TS_1747152587"/>
                    </NotMusica>
                </Merch>
            </TShirt>
            <Singolo chartPosition="1" isRemix="false">
                <mainTrack has_testo="1" nome="Traccia_1747152587_1">
                    <partecipanti>
                        <partecipante nome="ArtistaTest_1747152587"/>
                    </partecipanti>
                    <Durata minuti="3" ore="0" secondi="30"/>
                    <testo>Testo1</testo>
                </mainTrack>
                <Musica genere="Pop">
                    <dataUscita anno="2021" giorno="2" mese="2"/>
                    <Durata minuti="3" ore="0" secondi="30"/>
                    <ArtistProduct description="desc" imagePath="" title="Sing_1747152587"/>
                </Musica>
            </Singolo>
            <Album label="Label1">
                <tracce>
                    <Traccia has_testo="1" nome="Traccia_1747152587_1">
                        <partecipanti>
                            <partecipante nome="ArtistaTest_1747152587"/>
                        </partecipanti>
                        <Durata minuti="3" ore="0" secondi="30"/>
                        <testo>Testo1</testo>
                    </Traccia>
                    <Traccia has_testo="1" nome="Traccia_1747152587_1">
                        <partecipanti>
                            <partecipante nome="ArtistaTest_1747152587"/>
                        </partecipanti>
                        <Durata minuti="3" ore="0" secondi="30"/>
                        <testo>Testo1</testo>
                    </Traccia>
                </tracce>
                <Musica genere="Rock">
                    <dataUscita anno="2020" giorno="1" mese="1"/>
                    <Durata minuti="42" ore="0" secondi="10"/>
                    <ArtistProduct description="desc" imagePath="" title="Album_1747152587"/>
                </Musica>
            </Album>
        </prodotti>
    </Artista>
</artisti>
